{
  "$schema": "https://raw.githubusercontent.com/ctfpilot/schemas/refs/heads/main/challenge/schema.json",
  "enabled": true,
  "name": "Demo Casual Challenge",
  "slug": "demo-casual-challenge",
  "author": "The Mikkel",
  "category": "misc",
  "difficulty": "easy",
  "tags": ["demo", "casual", "example"],
  "type": "static",
  "instanced_type": "none",
  "flag": "flag{d3m0_fl4g}",
  "points": 1000,
  "min_points": 100,
  "description_location": "description.md",
  "prerequisites": [],
  "dockerfile_locations": [
    {
      "context": "demo/",
      "location": "demo/Dockerfile",
      "identifier": null
    }
  ]
}
